{
  "$schema": "../../content/schema/page.schema.json",
  "tenantId": "yammaman-brand",
  "pageId": "stores",
  "path": "/stores",
  "title": "Stores",
  "note": "PLACEHOLDER COPY. Addresses and hours are invented stand-ins — they must be replaced with real stockist data before this page is shown to anyone.",
  "seo": {
    "description": "Where to find Yammaman in person."
  },
  "blocks": [
    {
      "id": "stores-hero",
      "type": "hero",
      "props": {
        "eyebrow": "Stores",
        "heading": "See the cloth in person",
        "subheading": "Aizu Momen is hard to judge from a photograph. These are the places that stock it.",
        "align": "start"
      }
    },
    {
      "id": "stores-list",
      "type": "stores",
      "props": {
        "heading": "Stockists",
        "stores": [
          {
            "name": "Yammaman Atelier",
            "addressLines": ["2-1 Nanokamachi", "Aizuwakamatsu, Fukushima 965-0044", "Japan"],
            "hours": "Thu–Mon, 11:00–18:00",
            "phone": "+81 242 00 0000"
          },
          {
            "name": "Placeholder Stockist — Tokyo",
            "addressLines": ["0-0-0 Example", "Shibuya, Tokyo 150-0000", "Japan"],
            "hours": "Daily, 12:00–20:00"
          }
        ]
      }
    }
  ]
}
