{
  "$schema": "../../content/schema/page.schema.json",
  "tenantId": "yammaman-brand",
  "pageId": "home",
  "path": "/",
  "title": "Home",
  "note": "PLACEHOLDER COPY. Structure and block usage are the deliverable here; the words are dev-team stand-ins until Noi's content kickoff (Meeting 03, M10). Do not treat any sentence as approved client copy.",
  "seo": {
    "description": "Yammaman — made-to-order clothing woven on a 120-year-old Aizu cotton mill."
  },
  "blocks": [
    {
      "id": "home-hero",
      "type": "hero",
      "props": {
        "heading": "Yammaman",
        "subheading": "Made once, for one.",
        "brandMark": true,
        "description": [
          "Yammaman is made to order. Nothing is cut until you ask for it, which is why a garment takes three to four months and why the fabric can be one that has not been woven in years.",
          "The mill behind it, HARAPPA, has been running in Aizu since 2015 and its craft rather longer."
        ]
      }
    },
    {
      "id": "home-lookbook",
      "type": "marquee",
      "props": {
        "aspect": "3/4",
        "speed": "normal",
        "items": [
          {
            "src": "/assets/brand/dsc03456.jpg",
            "alt": "Yammaman lookbook photograph"
          },
          {
            "src": "/assets/reference/ref-4x5-01.jpg",
            "alt": "Reference photography placeholder 1 (4:5 portrait crop)"
          },
          {
            "src": "/assets/brand/dsc03471.jpg",
            "alt": "Yammaman lookbook photograph"
          },
          {
            "src": "/assets/reference/ref-3x4-01.png",
            "alt": "Reference photography placeholder 2 (3:4 portrait crop)"
          },
          {
            "src": "/assets/brand/dsc03562.jpg",
            "alt": "Yammaman lookbook photograph"
          },
          {
            "src": "/assets/reference/ref-2x3-01.png",
            "alt": "Reference photography placeholder 3 (2:3 portrait crop)"
          },
          {
            "src": "/assets/brand/img-8309.jpg",
            "alt": "Yammaman lookbook photograph"
          },
          {
            "src": "/assets/reference/ref-1x2-01.png",
            "alt": "Reference photography placeholder 4 (1:2 portrait crop)"
          }
        ]
      }
    }
  ]
}
